[
    {
        "decree_id": "StMaryMagdalene_Upgrade",
        "decree_date": "2016-06-03",
        "decree_protocol": "Prot. N. 257/16",
        "description": "By the express wish of the Holy Father, Pope Francis, the Dicastery for Divine Worship and the Discipline of the Sacraments and the Discipline of the Sacraments published a new Decree on the Solemnity of the Most Sacred Heart of Jesus, 3 June 2016, in which the celebration of Saint Mary Magdalene was elevated and inscribed in the General Roman Calendar with the rank of Feast.",
        "liturgical_event": {
            "event_key": "StMaryMagdalene",
            "grade": 4,
            "calendar":"GENERAL ROMAN"
        },
        "metadata": {
            "action": "setProperty",
            "since_year": 2016,
            "property": "grade",
            "url": "https://www.vatican.va/roman_curia/congregations/ccdds/documents/articolo-roche-maddalena_%s.pdf",
            "url_lang_map": {
                "de": "ge",
                "en": "en",
                "es": "sp",
                "fr": "fr",
                "it": "it",
                "la": "la",
                "pl": "pl",
                "pt": "po"
            },
            "urls_langs": {
                "de": "https://www.vatican.va/roman_curia/congregations/ccdds/documents/articolo-roche-maddalena_ge.pdf",
                "en": "https://www.vatican.va/roman_curia/congregations/ccdds/documents/articolo-roche-maddalena_en.pdf",
                "es": "https://www.vatican.va/roman_curia/congregations/ccdds/documents/articolo-roche-maddalena_sp.pdf",
                "fr": "https://www.vatican.va/roman_curia/congregations/ccdds/documents/articolo-roche-maddalena_fr.pdf",
                "it": "https://www.vatican.va/roman_curia/congregations/ccdds/documents/articolo-roche-maddalena_it.pdf",
                "la": "https://www.vatican.va/roman_curia/congregations/ccdds/documents/articolo-roche-maddalena_la.pdf",
                "pl": "https://www.vatican.va/roman_curia/congregations/ccdds/documents/articolo-roche-maddalena_pl.pdf",
                "pt": "https://www.vatican.va/roman_curia/congregations/ccdds/documents/articolo-roche-maddalena_po.pdf"
            }
        }
    },
    {
        "decree_id": "MaryMotherChurch_Create",
        "decree_date": "2018-02-11",
        "decree_protocol": "Prot. N. 10/18",
        "description": "Pope Francis has decreed that the Memorial of the Blessed Virgin Mary, Mother of the Church, should be inscribed in the Roman Calendar on the Monday after Pentecost and be now celebrated every year.",
        "liturgical_event": {
            "event_key": "MaryMotherChurch",
            "grade": 3,
            "common": ["Proper"],
            "calendar": "GENERAL ROMAN",
            "color": ["white"],
            "type": "mobile",
            "strtotime": {
                "day_of_the_week": "Monday",
                "relative_time": "after",
                "event_key": "Pentecost"
            }
        },
        "metadata": {
            "action": "createNew",
            "since_year": 2018,
            "url": "https://press.vatican.va/content/salastampa/it/bollettino/pubblico/2018/03/03/0168/00350.html#%s",
            "url_lang_map": {
                "la": "lat",
                "it": "italD",
                "fr": "francD",
                "en": "ingD",
                "de": "tedeD",
                "es": "spagnD",
                "pt": "portD"
            },
            "urls_langs": {
                "la": "https://press.vatican.va/content/salastampa/it/bollettino/pubblico/2018/03/03/0168/00350.html#lat",
                "it": "https://press.vatican.va/content/salastampa/it/bollettino/pubblico/2018/03/03/0168/00350.html#italD",
                "fr": "https://press.vatican.va/content/salastampa/it/bollettino/pubblico/2018/03/03/0168/00350.html#francD",
                "en": "https://press.vatican.va/content/salastampa/it/bollettino/pubblico/2018/03/03/0168/00350.html#ingD",
                "de": "https://press.vatican.va/content/salastampa/it/bollettino/pubblico/2018/03/03/0168/00350.html#tedeD",
                "es": "https://press.vatican.va/content/salastampa/it/bollettino/pubblico/2018/03/03/0168/00350.html#spagnD",
                "pt": "https://press.vatican.va/content/salastampa/it/bollettino/pubblico/2018/03/03/0168/00350.html#portD"
            }
        }
    },
    {
        "decree_id": "StMartha_NameChange",
        "decree_date": "2021-01-26",
        "decree_protocol": "Prot. N. 35/21",
        "description": "The Supreme Pontiff Pope FRANCIS, considering the important evangelical witness offered by Martha, Mary and Lazarus in welcoming the Lord Jesus into their home, in listening to him attentively, in believing that he is the resurrection and the life, and accepting the proposal of this Dicastery, has decreed that 29 July be designated in the General Roman Calendar as the Memorial of Saints Martha, Mary and Lazarus.",
        "liturgical_event": {
            "event_key": "StMartha",
            "calendar":"GENERAL ROMAN"
        },
        "metadata": {
            "action": "setProperty",
            "property": "name",
            "since_year": 2021,
            "url": "https://www.vatican.va/roman_curia/congregations/ccdds/documents/rc_con_ccdds_doc_20210126_decreto-santi_%s.html",
            "url_lang_map": {
                "de": "ge",
                "en": "en",
                "es": "sp",
                "fr": "fr",
                "it": "it",
                "la": "la",
                "pt": "po"
            },
            "urls_langs": {
                "de": "https://www.vatican.va/roman_curia/congregations/ccdds/documents/rc_con_ccdds_doc_20210126_decreto-santi_ge.html",
                "en": "https://www.vatican.va/roman_curia/congregations/ccdds/documents/rc_con_ccdds_doc_20210126_decreto-santi_en.html",
                "es": "https://www.vatican.va/roman_curia/congregations/ccdds/documents/rc_con_ccdds_doc_20210126_decreto-santi_sp.html",
                "fr": "https://www.vatican.va/roman_curia/congregations/ccdds/documents/rc_con_ccdds_doc_20210126_decreto-santi_fr.html",
                "it": "https://www.vatican.va/roman_curia/congregations/ccdds/documents/rc_con_ccdds_doc_20210126_decreto-santi_it.html",
                "la": "https://www.vatican.va/roman_curia/congregations/ccdds/documents/rc_con_ccdds_doc_20210126_decreto-santi_la.html",
                "pt": "https://www.vatican.va/roman_curia/congregations/ccdds/documents/rc_con_ccdds_doc_20210126_decreto-santi_po.html"
            }
        }
    },
    {
        "decree_id": "StJohnXXIII_Create",
        "decree_date": "2014-05-29",
        "decree_protocol": "Prot. N. 309/14",
        "description": "The Supreme Pontiff Francis, taking into consideration the universal wishes of the People of God from many and diverse regions of the world, has decreed that the celebrations of Pope Saint John XXIII and Pope Saint John Paul II should be inserted into the General Roman Calendar, to be observed annually with the rank of Optional Memorial, the first on 11 October, the second on 22 October.",
        "liturgical_event": {
            "event_key": "StJohnXXIII",
            "grade": 2,
            "month": 10,
            "day": 11,
            "common": ["Pastors:For a Pope"],
            "calendar": "GENERAL ROMAN",
            "color": ["white"],
            "type": "fixed"
        },
        "metadata": {
            "action": "createNew",
            "since_year": 2014,
            "url": "https://www.vatican.va/roman_curia/congregations/ccdds/documents/rc_con_ccdds_doc_20140529_decreto-calendario-generale-gxxiii-gpii_%s.html",
            "url_lang_map": {
                "en": "en",
                "es": "sp",
                "fr": "fr",
                "it": "it",
                "la": "la",
                "pt": "po"
            },
            "urls_langs": {
                "en": "https://www.vatican.va/roman_curia/congregations/ccdds/documents/rc_con_ccdds_doc_20140529_decreto-calendario-generale-gxxiii-gpii_en.html",
                "es": "https://www.vatican.va/roman_curia/congregations/ccdds/documents/rc_con_ccdds_doc_20140529_decreto-calendario-generale-gxxiii-gpii_sp.html",
                "fr": "https://www.vatican.va/roman_curia/congregations/ccdds/documents/rc_con_ccdds_doc_20140529_decreto-calendario-generale-gxxiii-gpii_fr.html",
                "it": "https://www.vatican.va/roman_curia/congregations/ccdds/documents/rc_con_ccdds_doc_20140529_decreto-calendario-generale-gxxiii-gpii_it.html",
                "la": "https://www.vatican.va/roman_curia/congregations/ccdds/documents/rc_con_ccdds_doc_20140529_decreto-calendario-generale-gxxiii-gpii_la.html",
                "pt": "https://www.vatican.va/roman_curia/congregations/ccdds/documents/rc_con_ccdds_doc_20140529_decreto-calendario-generale-gxxiii-gpii_po.html"
            }
        }
    },
    {
        "decree_id": "StJohnPaulII_Create",
        "decree_date": "2014-05-29",
        "decree_protocol": "Prot. N. 309/14",
        "description": "The Supreme Pontiff Francis, taking into consideration the universal whishes of the People of God from many and diverse regions of the world, has decreed that the celebrations of Pope Saint John XXIII and Pope Saint John Paul II should be inserted into the General Roman Calendar, to be observed annually with the rank of Optional Memorial, the first on 11 October, the second on 22 October.",
        "liturgical_event": {
            "event_key": "StJohnPaulII",
            "grade": 2,
            "month": 10,
            "day": 22,
            "common": ["Pastors:For a Pope"],
            "calendar": "GENERAL ROMAN",
            "color": ["white"],
            "type": "fixed"
        },
        "metadata": {
            "action": "createNew",
            "since_year": 2014,